{
  "id": "cover3-tackle",
  "name": "Cover 3 (Three Deep)",
  "variant": "tackle11",
  "side": "defense",
  "description": "Three defenders split the deep field in thirds: both cornerbacks and the free safety. The strong safety comes down to help underneath. Strong deep, but the seams between the thirds can be attacked.",
  "players": [
    {
      "id": "lde",
      "position": "DE",
      "x": -5.5,
      "y": 1
    },
    {
      "id": "ldt",
      "position": "DT",
      "x": -2,
      "y": 1
    },
    {
      "id": "rdt",
      "position": "DT",
      "x": 3,
      "y": 1
    },
    {
      "id": "rde",
      "position": "DE",
      "x": 7,
      "y": 1
    },
    {
      "id": "will",
      "position": "LB",
      "x": -4.5,
      "y": 4.5,
      "label": "W"
    },
    {
      "id": "mike",
      "position": "LB",
      "x": 0,
      "y": 4.5,
      "label": "M"
    },
    {
      "id": "sam",
      "position": "LB",
      "x": 6,
      "y": 4.5,
      "label": "S"
    },
    {
      "id": "lcb",
      "position": "CB",
      "x": -19,
      "y": 8
    },
    {
      "id": "rcb",
      "position": "CB",
      "x": 19,
      "y": 8
    },
    {
      "id": "fs",
      "position": "S",
      "x": 0,
      "y": 14,
      "label": "FS"
    },
    {
      "id": "ss",
      "position": "S",
      "x": 9,
      "y": 8,
      "label": "SS"
    }
  ]
}
